{
  "$schema": "https://json-schema.org/draft/2020-12/schema",
  "$id": "https://calisthenics-movement-intelligence.local/contracts/tooling/preprocessing_vector.v1.schema.json",
  "title": "PreprocessingVector v1",
  "description": "Descriptor for one synthetic RGB24 scale/pad golden vector. It pairs a reference input plane with the expected output plane and is independent of FixtureMetadata, which describes decoded frame sequences rather than geometry-function pairs. Unknown optional properties are tolerated so the contract can evolve within major version 1.",
  "type": "object",
  "required": [
    "tooling_schema_version",
    "synthetic",
    "input_width",
    "input_height",
    "output_width",
    "output_height",
    "input_path",
    "input_byte_length",
    "input_sha256",
    "expected_output_path",
    "expected_output_byte_length",
    "expected_output_sha256"
  ],
  "additionalProperties": true,
  "properties": {
    "tooling_schema_version": {
      "description": "Semantic version of this tooling contract, independent of the observation schemas.",
      "type": "string",
      "pattern": "^(0|[1-9][0-9]*)\\.(0|[1-9][0-9]*)\\.(0|[1-9][0-9]*)$"
    },
    "synthetic": {
      "description": "Deliberately generated provenance. Only synthetic vectors may be committed.",
      "const": true
    },
    "vector_id": {
      "description": "Stable identifier for the vector within the repository.",
      "type": "string",
      "minLength": 1
    },
    "input_width": {
      "type": "integer",
      "minimum": 1
    },
    "input_height": {
      "type": "integer",
      "minimum": 1
    },
    "output_width": {
      "description": "Target rectangle width the input is scaled and padded into.",
      "type": "integer",
      "minimum": 1
    },
    "output_height": {
      "description": "Target rectangle height the input is scaled and padded into.",
      "type": "integer",
      "minimum": 1
    },
    "input_path": {
      "description": "Repository-relative path of the packed RGB24 input plane.",
      "type": "string",
      "minLength": 1
    },
    "input_byte_length": {
      "type": "integer",
      "minimum": 1
    },
    "input_sha256": {
      "type": "string",
      "pattern": "^[0-9a-f]{64}$"
    },
    "expected_output_path": {
      "description": "Repository-relative path of the packed RGB24 plane the reference scale/pad must produce.",
      "type": "string",
      "minLength": 1
    },
    "expected_output_byte_length": {
      "type": "integer",
      "minimum": 1
    },
    "expected_output_sha256": {
      "type": "string",
      "pattern": "^[0-9a-f]{64}$"
    },
    "description": {
      "description": "Human-readable summary of the geometry case the vector covers.",
      "type": "string"
    }
  }
}
